{
  "$schema": "https://ryuki.io/schemas/security-contracts/v1/security-limit-profile.schema.json",
  "schema_version": "1.0.0",
  "contract_kind": "security-limit-profile",
  "document_id": "security-limit-profile:repository-implementation-v1",
  "document_version": 1,
  "lifecycle": {
    "state": "implementation_only",
    "effective_at": "2026-07-16T00:00:00Z"
  },
  "applicability": {
    "evaluation_scope": "implementation",
    "security_profiles": ["development", "test", "production"],
    "deployment_ids": [],
    "enabled_feature_ids": ["session-lookup-admission"]
  },
  "profile_version": 1,
  "hard_bounds_revision": 1,
  "coverage_status": "transitional_snapshot",
  "normative_categories": ["request-bytes", "response-bytes", "parsing-work", "concurrency", "queue-growth", "durable-state-growth", "query-page", "query-lookback", "scheduler-batch", "retention-batch", "subprocess-count", "subprocess-runtime", "subprocess-tree", "output-bytes", "artifact-bytes", "disk-bytes", "memory-bytes", "probe", "retry", "replay-retention", "idempotency-retention", "fairness"],
  "covered_categories": ["cache-capacity", "ttl", "rate", "concurrency", "query-page"],
  "boundary_fixture_catalog_ref": {
    "document_id": "boundary-fixture-catalog:security-limit-repository-v1",
    "document_version": 1,
    "content_digest": "sha256:d6403563242d27e104c8962b2693b52ef8e078419c9cf2579490a5c18d2575fd",
    "artifact_locator": "docs/architecture/platform-security-boundary.md"
  },
  "immutable": true,
  "limits": [
    {
      "limit_id": "limit:session-lookup.positive-cache-capacity",
      "category": "cache-capacity",
      "description": "Maximum number of value-free positive session admission hints retained per replica.",
      "selected_value": 65536,
      "published_default": 65536,
      "unit": "items",
      "scope": {
        "kind": "replica",
        "dimensions": ["replica_id"]
      },
      "hard_bounds": {
        "minimum": 1,
        "maximum": 1048576,
        "minimum_inclusive": true,
        "maximum_inclusive": true
      },
      "owner": "api-security",
      "value_change_authority": {
        "authority_id": "authority:runtime-security-config",
        "owning_team": "platform-security",
        "required_controls": ["review", "step-up"]
      },
      "bound_change_authority": {
        "authority_id": "authority:security-contract-bounds",
        "owning_team": "platform-security",
        "required_controls": ["review", "maker-checker", "contract-revision", "new-conformance-evidence"]
      },
      "failure_projection": {
        "mode": "reject-before-allocation",
        "stable_code": "SESSION_LOOKUP_ADMISSION_EXCEEDED",
        "http_status": 429,
        "retryable": true,
        "queueing_allowed": false,
        "value_free": true
      },
      "telemetry": {
        "metric_name": "ryuki_session_lookup_limit_profile",
        "cardinality": "constant",
        "value_free": true
      },
      "procedures": {
        "value_change": "procedure:security-limit-value-change-v1",
        "bound_change": "procedure:security-limit-bound-change-v1",
        "rollback": "procedure:security-limit-rollback-v1",
        "evidence_requirements": ["evidence-requirement:boundary-and-plus-one-v1"]
      },
      "enforcement_status": "partially_enforced",
      "source_binding": {
        "source_file": "sources/ryuki-api/src/session_lookup_admission.rs",
        "source_symbol": "ACTIVE_SESSION_LOOKUP_LIMIT_PROFILE.positive_cache_capacity"
      },
      "overrides": []
    },
    {
      "limit_id": "limit:session-lookup.negative-cache-capacity",
      "category": "cache-capacity",
      "description": "Maximum number of value-free negative session lookup hints retained per replica.",
      "selected_value": 4096,
      "published_default": 4096,
      "unit": "items",
      "scope": {
        "kind": "replica",
        "dimensions": ["replica_id"]
      },
      "hard_bounds": {
        "minimum": 1,
        "maximum": 1048576,
        "minimum_inclusive": true,
        "maximum_inclusive": true
      },
      "owner": "api-security",
      "value_change_authority": {
        "authority_id": "authority:runtime-security-config",
        "owning_team": "platform-security",
        "required_controls": ["review", "step-up"]
      },
      "bound_change_authority": {
        "authority_id": "authority:security-contract-bounds",
        "owning_team": "platform-security",
        "required_controls": ["review", "maker-checker", "contract-revision", "new-conformance-evidence"]
      },
      "failure_projection": {
        "mode": "reject-before-allocation",
        "stable_code": "SESSION_LOOKUP_ADMISSION_EXCEEDED",
        "http_status": 429,
        "retryable": true,
        "queueing_allowed": false,
        "value_free": true
      },
      "telemetry": {
        "metric_name": "ryuki_session_lookup_limit_profile",
        "cardinality": "constant",
        "value_free": true
      },
      "procedures": {
        "value_change": "procedure:security-limit-value-change-v1",
        "bound_change": "procedure:security-limit-bound-change-v1",
        "rollback": "procedure:security-limit-rollback-v1",
        "evidence_requirements": ["evidence-requirement:boundary-and-plus-one-v1"]
      },
      "enforcement_status": "partially_enforced",
      "source_binding": {
        "source_file": "sources/ryuki-api/src/session_lookup_admission.rs",
        "source_symbol": "ACTIVE_SESSION_LOOKUP_LIMIT_PROFILE.negative_cache_capacity"
      },
      "overrides": []
    },
    {
      "limit_id": "limit:session-lookup.positive-cache-max-ttl",
      "category": "ttl",
      "description": "Maximum lifetime of a positive admission hint before authority is re-established.",
      "selected_value": 30,
      "published_default": 30,
      "unit": "seconds",
      "scope": {
        "kind": "replica",
        "dimensions": ["replica_id"]
      },
      "hard_bounds": {
        "minimum": 1,
        "maximum": 300,
        "minimum_inclusive": true,
        "maximum_inclusive": true
      },
      "owner": "api-security",
      "value_change_authority": {
        "authority_id": "authority:runtime-security-config",
        "owning_team": "platform-security",
        "required_controls": ["review", "step-up"]
      },
      "bound_change_authority": {
        "authority_id": "authority:security-contract-bounds",
        "owning_team": "platform-security",
        "required_controls": ["review", "maker-checker", "contract-revision", "new-conformance-evidence"]
      },
      "failure_projection": {
        "mode": "expire",
        "stable_code": "SESSION_LOOKUP_HINT_EXPIRED",
        "retryable": true,
        "queueing_allowed": false,
        "value_free": true
      },
      "telemetry": {
        "metric_name": "ryuki_session_lookup_limit_profile",
        "cardinality": "constant",
        "value_free": true
      },
      "procedures": {
        "value_change": "procedure:security-limit-value-change-v1",
        "bound_change": "procedure:security-limit-bound-change-v1",
        "rollback": "procedure:security-limit-rollback-v1",
        "evidence_requirements": ["evidence-requirement:boundary-and-plus-one-v1"]
      },
      "enforcement_status": "partially_enforced",
      "source_binding": {
        "source_file": "sources/ryuki-api/src/session_lookup_admission.rs",
        "source_symbol": "ACTIVE_SESSION_LOOKUP_LIMIT_PROFILE.positive_cache_max_ttl_secs"
      },
      "overrides": []
    },
    {
      "limit_id": "limit:session-lookup.negative-cache-ttl",
      "category": "ttl",
      "description": "Lifetime of a confirmed negative session lookup hint.",
      "selected_value": 30,
      "published_default": 30,
      "unit": "seconds",
      "scope": {
        "kind": "replica",
        "dimensions": ["replica_id"]
      },
      "hard_bounds": {
        "minimum": 1,
        "maximum": 300,
        "minimum_inclusive": true,
        "maximum_inclusive": true
      },
      "owner": "api-security",
      "value_change_authority": {
        "authority_id": "authority:runtime-security-config",
        "owning_team": "platform-security",
        "required_controls": ["review", "step-up"]
      },
      "bound_change_authority": {
        "authority_id": "authority:security-contract-bounds",
        "owning_team": "platform-security",
        "required_controls": ["review", "maker-checker", "contract-revision", "new-conformance-evidence"]
      },
      "failure_projection": {
        "mode": "expire",
        "stable_code": "SESSION_LOOKUP_NEGATIVE_HINT_EXPIRED",
        "retryable": true,
        "queueing_allowed": false,
        "value_free": true
      },
      "telemetry": {
        "metric_name": "ryuki_session_lookup_limit_profile",
        "cardinality": "constant",
        "value_free": true
      },
      "procedures": {
        "value_change": "procedure:security-limit-value-change-v1",
        "bound_change": "procedure:security-limit-bound-change-v1",
        "rollback": "procedure:security-limit-rollback-v1",
        "evidence_requirements": ["evidence-requirement:boundary-and-plus-one-v1"]
      },
      "enforcement_status": "partially_enforced",
      "source_binding": {
        "source_file": "sources/ryuki-api/src/session_lookup_admission.rs",
        "source_symbol": "ACTIVE_SESSION_LOOKUP_LIMIT_PROFILE.negative_cache_ttl_secs"
      },
      "overrides": []
    },
    {
      "limit_id": "limit:session-lookup.miss-window",
      "category": "rate",
      "description": "Fixed admission window for unknown session verifiers.",
      "selected_value": 1,
      "published_default": 1,
      "unit": "seconds",
      "scope": {
        "kind": "replica",
        "dimensions": ["replica_id"]
      },
      "hard_bounds": {
        "minimum": 1,
        "maximum": 60,
        "minimum_inclusive": true,
        "maximum_inclusive": true
      },
      "owner": "api-security",